{
  "schemaVersion": 1,
  "id": "opencode-completed-sessions-v1",
  "generator": "opencode-completed-sessions-v1",
  "seed": "agent-app-benchmark-public-v4",
  "sourceEventFormat": {
    "id": "opencode-event-v2",
    "sourceRevision": "a9f7081d4015b0cc22ed67156e042b482a8d064a",
    "envelope": "EventV2.SerializedEvent",
    "eventTypes": [
      "session.created.1",
      "message.updated.1",
      "message.part.updated.1"
    ]
  },
  "workspaceIds": [
    "workspace-a",
    "workspace-b"
  ],
  "transcriptBytes": [
    1048576,
    8388608,
    33554432,
    134217728
  ],
  "benchmarkTopology": {
    "standardTranscriptBytes": 1048576,
    "latencySamplesPerProcess": 5,
    "sizeSamplesPerProcess": 2,
    "longRowTranscriptBytes": [
      1048576,
      8388608,
      33554432
    ]
  },
  "sessionProfiles": [
    {
      "transcriptBytes": 1048576,
      "userMessages": 20,
      "assistantMessages": 132,
      "toolCalls": 270,
      "patches": 15,
      "payloadPermille": {
        "text": 80,
        "reasoning": 80,
        "toolInput": 120,
        "toolOutput": 720
      }
    },
    {
      "transcriptBytes": 8388608,
      "userMessages": 80,
      "assistantMessages": 700,
      "toolCalls": 1600,
      "patches": 120,
      "payloadPermille": {
        "text": 60,
        "reasoning": 60,
        "toolInput": 100,
        "toolOutput": 780
      }
    },
    {
      "transcriptBytes": 33554432,
      "userMessages": 240,
      "assistantMessages": 2500,
      "toolCalls": 6000,
      "patches": 400,
      "payloadPermille": {
        "text": 50,
        "reasoning": 50,
        "toolInput": 90,
        "toolOutput": 810
      }
    },
    {
      "transcriptBytes": 134217728,
      "userMessages": 400,
      "assistantMessages": 4000,
      "toolCalls": 12000,
      "patches": 1000,
      "payloadPermille": {
        "text": 50,
        "reasoning": 20,
        "toolInput": 80,
        "toolOutput": 850
      }
    }
  ],
  "derivation": {
    "method": "rounded structural distributions with entirely synthetic payloads",
    "sourceFamilies": [
      "opencode",
      "claude-code",
      "codex"
    ],
    "privateContentCopied": false
  },
  "description": "Privacy-safe completed coding-agent histories with independent session pools for latency, counterbalanced size sweeps, and fresh progressive memory-retention runs.  five latency samples per lane instead of ten, plus long-row sessions (1 and 8 MiB carried in eight text rows, 32 MiB in thirty-two, so every row is 128 KiB to 1 MiB) so a virtualized transcript cannot hide the cost of a single very long row.",
  "longRowProfiles": [
    {
      "transcriptBytes": 1048576,
      "userMessages": 4,
      "assistantMessages": 4,
      "toolCalls": 0,
      "patches": 0,
      "payloadPermille": {
        "text": 1000,
        "reasoning": 0,
        "toolInput": 0,
        "toolOutput": 0
      }
    },
    {
      "transcriptBytes": 8388608,
      "userMessages": 4,
      "assistantMessages": 4,
      "toolCalls": 0,
      "patches": 0,
      "payloadPermille": {
        "text": 1000,
        "reasoning": 0,
        "toolInput": 0,
        "toolOutput": 0
      }
    },
    {
      "transcriptBytes": 33554432,
      "userMessages": 16,
      "assistantMessages": 16,
      "toolCalls": 0,
      "patches": 0,
      "payloadPermille": {
        "text": 1000,
        "reasoning": 0,
        "toolInput": 0,
        "toolOutput": 0
      }
    }
  ]
}
